{
  "$schema": "https://json-schema.org/draft/2020-12/schema",
  "$id": "https://erdesigns.eu/schema/j1939-fmi.json",
  "title": "j1939-fmi",
  "type": "object",
  "required": [
    "schema_version",
    "entries"
  ],
  "properties": {
    "$schema": {
      "type": "string"
    },
    "schema_version": {
      "const": 1
    },
    "version": {
      "type": "integer",
      "enum": [
        1,
        2
      ]
    },
    "description": {
      "type": "string"
    },
    "source": {
      "type": "string"
    },
    "spec": {
      "type": "string"
    },
    "type": {
      "type": "string"
    },
    "kind": {
      "type": "string"
    },
    "oem": {
      "type": "string"
    },
    "fields": {
      "type": "object",
      "additionalProperties": {
        "type": "string"
      }
    },
    "entries": {
      "type": "array",
      "items": {
        "type": "object",
        "required": [
          "id",
          "name"
        ],
        "properties": {
          "id": {
            "type": "integer",
            "minimum": 0,
            "maximum": 31
          },
          "name": {
            "type": "string"
          },
          "short": {
            "type": "string"
          }
        },
        "additionalProperties": false
      }
    }
  },
  "additionalProperties": false
}
