{
  "$schema": "https://erdesigns.eu/schema/j1939-fmi.json",
  "schema_version": 1,
  "description": "SAE J1939-73 §5.7.13 Failure Mode Identifiers (FMI). 5-bit value packed into byte 2 of every DTC record on DM1/DM2/DM6/DM12/DM23/DM27/DM28.",
  "kind": "j1939-fmi",
  "source": "SAE J1939-73:2024 §5.7.13 Table 4",
  "entries": [
    { "id":  0, "name": "Data Valid But Above Normal Operational Range — Most Severe Level",
                "short": "Above normal — most severe" },
    { "id":  1, "name": "Data Valid But Below Normal Operational Range — Most Severe Level",
                "short": "Below normal — most severe" },
    { "id":  2, "name": "Data Erratic, Intermittent or Incorrect",
                "short": "Erratic / intermittent / incorrect" },
    { "id":  3, "name": "Voltage Above Normal or Shorted to High Source",
                "short": "Voltage high / short to high" },
    { "id":  4, "name": "Voltage Below Normal or Shorted to Low Source",
                "short": "Voltage low / short to low" },
    { "id":  5, "name": "Current Below Normal or Open Circuit",
                "short": "Current low / open circuit" },
    { "id":  6, "name": "Current Above Normal or Grounded Circuit",
                "short": "Current high / shorted to ground" },
    { "id":  7, "name": "Mechanical System Not Responding or Out of Adjustment",
                "short": "Mechanical not responding" },
    { "id":  8, "name": "Abnormal Frequency, Pulse Width or Period",
                "short": "Frequency / pulse-width abnormal" },
    { "id":  9, "name": "Abnormal Update Rate",
                "short": "Update rate abnormal" },
    { "id": 10, "name": "Abnormal Rate of Change",
                "short": "Rate of change abnormal" },
    { "id": 11, "name": "Root Cause Not Known",
                "short": "Root cause unknown" },
    { "id": 12, "name": "Bad Intelligent Device or Component",
                "short": "Bad intelligent device" },
    { "id": 13, "name": "Out of Calibration",
                "short": "Out of calibration" },
    { "id": 14, "name": "Special Instructions",
                "short": "Special instructions" },
    { "id": 15, "name": "Data Valid But Above Normal Operating Range — Least Severe Level",
                "short": "Above normal — least severe" },
    { "id": 16, "name": "Data Valid But Above Normal Operating Range — Moderately Severe Level",
                "short": "Above normal — moderate" },
    { "id": 17, "name": "Data Valid But Below Normal Operating Range — Least Severe Level",
                "short": "Below normal — least severe" },
    { "id": 18, "name": "Data Valid But Below Normal Operating Range — Moderately Severe Level",
                "short": "Below normal — moderate" },
    { "id": 19, "name": "Received Network Data In Error",
                "short": "Received network data in error" },
    { "id": 20, "name": "Data Drifted High",
                "short": "Data drifted high" },
    { "id": 21, "name": "Data Drifted Low",
                "short": "Data drifted low" },
    { "id": 31, "name": "Condition Exists",
                "short": "Condition exists" }
  ]
}
